{"record_schema_version":"1.1.0","task_id":"TASK-004","project_id":"javascript-roulette","record_revision":1,"task_status":"ACTIVE","current_phase":"DESIGN","gate_status":"FAIL","authorization_status":"NOT_REQUIRED","archive_status":"NOT_ELIGIBLE","status_reason":"Phase 1 prototype fixture.","entered_at":"2026-07-27T00:00:00Z","updated_at":"2026-07-27T00:00:00Z","last_verified_at":"2026-07-27T00:00:00Z","requested_by":{"actor_id":"builder-1","actor_type":"ROLE","role_id":"Builder","session_id":null,"run_id":null},"authorized_by":{"actor_id":"SYSTEM_RULE","actor_type":"SYSTEM_COMPONENT","role_id":null,"session_id":null,"run_id":null},"applied_by":{"actor_id":"lifecycle-manager-1","actor_type":"SYSTEM_COMPONENT","role_id":null,"session_id":null,"run_id":null},"authorization_reference":{"authorization_id":"SYSTEM_RULE","authority_type":"RULE","authority_path":"docs/ai-team/common/Workflow-Specification.md","authority_checksum":"sha256:aaaaaaaaaaaaaaaaaaaaaaaaaaaaaaaaaaaaaaaaaaaaaaaaaaaaaaaaaaaaaaaa","decision":"NOT_REQUIRED","effective_at":"2026-07-27T00:00:00Z","expires_at":null,"scope":{"task_id":"TASK-004","phases":["DESIGN"],"operations":["CANONICAL_STATE_COMMIT"]}},"authoritative_evidence":[{"path":"docs/ai-team/tasks/TASK-004/final-plan.md","checksum":"sha256:bbbbbbbbbbbbbbbbbbbbbbbbbbbbbbbbbbbbbbbbbbbbbbbbbbbbbbbbbbbbbbbb","authoring_role":"Builder","result":"PASS","observed_at":"2026-07-27T00:00:00Z"}],"blocking_items":[],"next_eligible_phases":["DESIGN"],"verification_result":"PASS","last_transition_id":"00000000-0000-4000-8000-000000000001","content_checksum":"sha256:c1de576cc259cb278bf6288da79814f7a35b07238505a402be3010d6eb40021a"}